{
  "schema_version": 1,
  "updated_date": "2026-08-15",
  "asset_base_url": "https://fastnas2023.github.io/vasture-website/",
  "products": [
    {
      "id": "strategic-ventilation-jacket",
      "sku": null,
      "name_zh": "战略通风轻量夹克",
      "name_en": "STRATEGIC VENTILATION JACKET",
      "description_zh": "方案包含腋下与背部通风、快干透气、可收纳设计及防泼水功能，适合户外施工与团队工服开发。",
      "product_type": "jacket",
      "tags": [
        "jacket",
        "workwear",
        "waterproof",
        "functional",
        "outdoor",
        "project"
      ],
      "main_image": "assets/modish/main/strategic-ventilation-jacket.webp",
      "image_alt_zh": "战略通风轻量工作夹克",
      "gallery_images": [
        "assets/modish/pages/page-02.webp"
      ],
      "badge": "ODM方案",
      "supply_mode": "odm_proposal",
      "moq_label": "开发",
      "moq_value": "按项目确认",
      "stock_status": "not_claimed",
      "catalogue_id": "modish-centro-edile-en-v2",
      "catalogue_name": "Modish Centro Edile (English v.2)",
      "source_file": "产品图册/modish-centro-edile-en-v2.pdf",
      "source_pages": [
        2
      ],
      "added_date": "2026-08-14",
      "source_status": "catalogue_linked",
      "visibility": "public",
      "sort_order": 1
    },
    {
      "id": "ultra-light-rain-coat",
      "sku": null,
      "name_zh": "超轻量防水雨衣",
      "name_en": "ULTRA LIGHTWEIGHT RAIN COAT",
      "description_zh": "方案页标注2.5层防水面料、压胶缝和可收纳结构，适合雨天作业、通勤及轻量户外场景。",
      "product_type": "jacket",
      "tags": [
        "jacket",
        "workwear",
        "waterproof",
        "functional",
        "outdoor",
        "project"
      ],
      "main_image": "assets/modish/main/ultra-light-rain-coat.webp",
      "image_alt_zh": "超轻量防水雨衣",
      "gallery_images": [
        "assets/modish/pages/page-03.webp"
      ],
      "badge": "ODM方案",
      "supply_mode": "odm_proposal",
      "moq_label": "开发",
      "moq_value": "按项目确认",
      "stock_status": "not_claimed",
      "catalogue_id": "modish-centro-edile-en-v2",
      "catalogue_name": "Modish Centro Edile (English v.2)",
      "source_file": "产品图册/modish-centro-edile-en-v2.pdf",
      "source_pages": [
        3
      ],
      "added_date": "2026-08-14",
      "source_status": "catalogue_linked",
      "visibility": "public",
      "sort_order": 2
    },
    {
      "id": "multi-pocket-tech-jacket",
      "sku": null,
      "name_zh": "多口袋功能夹克",
      "name_en": "MULTI-POCKET TECH JACKET",
      "description_zh": "围绕多区域收纳、快速取物、可调节细节和轻量耐用结构设计，适合作业工具与随身设备携带。",
      "product_type": "jacket",
      "tags": [
        "jacket",
        "workwear",
        "waterproof",
        "functional",
        "outdoor",
        "project"
      ],
      "main_image": "assets/modish/main/multi-pocket-tech-jacket.webp",
      "image_alt_zh": "多口袋功能工作夹克",
      "gallery_images": [
        "assets/modish/pages/page-04.webp",
        "assets/modish/pages/page-06.webp"
      ],
      "badge": "ODM方案",
      "supply_mode": "odm_proposal",
      "moq_label": "开发",
      "moq_value": "按项目确认",
      "stock_status": "not_claimed",
      "catalogue_id": "modish-centro-edile-en-v2",
      "catalogue_name": "Modish Centro Edile (English v.2)",
      "source_file": "产品图册/modish-centro-edile-en-v2.pdf",
      "source_pages": [
        4,
        6
      ],
      "added_date": "2026-08-14",
      "source_status": "catalogue_linked",
      "visibility": "public",
      "sort_order": 3
    },
    {
      "id": "softshell-jacket",
      "sku": null,
      "name_zh": "三层弹力软壳夹克",
      "name_en": "3-LAYER SOFTSHELL JACKET",
      "description_zh": "方案包含可拆帽、通风区、功能口袋和三层弹力软壳结构，适合多天气户外作业与技术团队。",
      "product_type": "jacket",
      "tags": [
        "jacket",
        "workwear",
        "softshell",
        "waterproof",
        "functional",
        "outdoor",
        "project"
      ],
      "main_image": "assets/modish/main/softshell-jacket.webp",
      "image_alt_zh": "三层弹力软壳工作夹克",
      "gallery_images": [
        "assets/modish/pages/page-05.webp"
      ],
      "badge": "ODM方案",
      "supply_mode": "odm_proposal",
      "moq_label": "开发",
      "moq_value": "按项目确认",
      "stock_status": "not_claimed",
      "catalogue_id": "modish-centro-edile-en-v2",
      "catalogue_name": "Modish Centro Edile (English v.2)",
      "source_file": "产品图册/modish-centro-edile-en-v2.pdf",
      "source_pages": [
        5
      ],
      "added_date": "2026-08-14",
      "source_status": "catalogue_linked",
      "visibility": "public",
      "sort_order": 4
    },
    {
      "id": "tech-crew-utility-vest",
      "sku": null,
      "name_zh": "技术团队多口袋背心",
      "name_en": "TECH CREW UTILITY VEST",
      "description_zh": "轻量背心方案结合透气背片、可调节肩部与侧腰、模块化口袋和反光细节，便于工具分类携带。",
      "product_type": "vest",
      "tags": [
        "vest",
        "workwear",
        "mesh",
        "functional",
        "outdoor",
        "project"
      ],
      "main_image": "assets/modish/main/tech-crew-utility-vest.webp",
      "image_alt_zh": "轻量多口袋技术工作背心",
      "gallery_images": [
        "assets/modish/pages/page-07.webp"
      ],
      "badge": "ODM方案",
      "supply_mode": "odm_proposal",
      "moq_label": "开发",
      "moq_value": "按项目确认",
      "stock_status": "not_claimed",
      "catalogue_id": "modish-centro-edile-en-v2",
      "catalogue_name": "Modish Centro Edile (English v.2)",
      "source_file": "产品图册/modish-centro-edile-en-v2.pdf",
      "source_pages": [
        7
      ],
      "added_date": "2026-08-14",
      "source_status": "catalogue_linked",
      "visibility": "public",
      "sort_order": 5
    },
    {
      "id": "thermal-work-pants",
      "sku": null,
      "name_zh": "保暖弹力工作裤",
      "name_en": "THERMAL WORK PANTS",
      "description_zh": "方案页标注四向弹力、加固口袋、工具环和保暖内层，面向低温施工及长时间活动需求。",
      "product_type": "pants",
      "tags": [
        "pants",
        "workwear",
        "functional",
        "outdoor",
        "project",
        "stretch",
        "waterproof"
      ],
      "main_image": "assets/modish/main/thermal-work-pants.webp",
      "image_alt_zh": "保暖弹力工作裤",
      "gallery_images": [
        "assets/modish/pages/page-08.webp"
      ],
      "badge": "ODM方案",
      "supply_mode": "odm_proposal",
      "moq_label": "开发",
      "moq_value": "按项目确认",
      "stock_status": "not_claimed",
      "catalogue_id": "modish-centro-edile-en-v2",
      "catalogue_name": "Modish Centro Edile (English v.2)",
      "source_file": "产品图册/modish-centro-edile-en-v2.pdf",
      "source_pages": [
        8
      ],
      "added_date": "2026-08-14",
      "source_status": "catalogue_linked",
      "visibility": "public",
      "sort_order": 6
    },
    {
      "id": "cargo-pant-02",
      "sku": null,
      "name_zh": "02 多口袋工装裤",
      "name_en": "02 CARGO PANT",
      "description_zh": "多口袋、工具位、加固腰袢与后腰弹力结构，适合建筑、物流、安装和移动作业团队。",
      "product_type": "pants",
      "tags": [
        "pants",
        "workwear",
        "functional",
        "outdoor",
        "project",
        "stretch",
        "waterproof"
      ],
      "main_image": "assets/modish/main/cargo-pant-02.webp",
      "image_alt_zh": "02多口袋弹力工装裤",
      "gallery_images": [
        "assets/modish/pages/page-09.webp"
      ],
      "badge": "ODM方案",
      "supply_mode": "odm_proposal",
      "moq_label": "开发",
      "moq_value": "按项目确认",
      "stock_status": "not_claimed",
      "catalogue_id": "modish-centro-edile-en-v2",
      "catalogue_name": "Modish Centro Edile (English v.2)",
      "source_file": "产品图册/modish-centro-edile-en-v2.pdf",
      "source_pages": [
        9
      ],
      "added_date": "2026-08-14",
      "source_status": "catalogue_linked",
      "visibility": "public",
      "sort_order": 7
    },
    {
      "id": "tech-motion-work-pant",
      "sku": null,
      "name_zh": "隐藏护膝功能工作裤",
      "name_en": "TECH MOTION WORK PANT",
      "description_zh": "内置隐藏式可更换护膝袋、膝后网眼通风和弹力面料，适合需要频繁跪姿操作的工种。",
      "product_type": "pants",
      "tags": [
        "pants",
        "workwear",
        "functional",
        "outdoor",
        "project",
        "stretch",
        "waterproof"
      ],
      "main_image": "assets/modish/main/tech-motion-work-pant.webp",
      "image_alt_zh": "隐藏护膝功能工作裤",
      "gallery_images": [
        "assets/modish/pages/page-10.webp"
      ],
      "badge": "ODM方案",
      "supply_mode": "odm_proposal",
      "moq_label": "开发",
      "moq_value": "按项目确认",
      "stock_status": "not_claimed",
      "catalogue_id": "modish-centro-edile-en-v2",
      "catalogue_name": "Modish Centro Edile (English v.2)",
      "source_file": "产品图册/modish-centro-edile-en-v2.pdf",
      "source_pages": [
        10
      ],
      "added_date": "2026-08-14",
      "source_status": "catalogue_linked",
      "visibility": "public",
      "sort_order": 8
    },
    {
      "id": "convertible-performance-pant",
      "sku": null,
      "name_zh": "可拆卸裤腿两用工作裤",
      "name_en": "CONVERTIBLE PERFORMANCE PANT",
      "description_zh": "隐藏拉链可在长裤与短裤间切换，并结合弹力、防泼水和工具收纳细节，适应季节变化。",
      "product_type": "pants",
      "tags": [
        "pants",
        "workwear",
        "functional",
        "outdoor",
        "project",
        "stretch",
        "waterproof"
      ],
      "main_image": "assets/modish/main/convertible-performance-pant.webp",
      "image_alt_zh": "可拆卸裤腿两用工作裤",
      "gallery_images": [
        "assets/modish/pages/page-11.webp"
      ],
      "badge": "ODM方案",
      "supply_mode": "odm_proposal",
      "moq_label": "开发",
      "moq_value": "按项目确认",
      "stock_status": "not_claimed",
      "catalogue_id": "modish-centro-edile-en-v2",
      "catalogue_name": "Modish Centro Edile (English v.2)",
      "source_file": "产品图册/modish-centro-edile-en-v2.pdf",
      "source_pages": [
        11
      ],
      "added_date": "2026-08-14",
      "source_status": "catalogue_linked",
      "visibility": "public",
      "sort_order": 9
    },
    {
      "id": "hydroactive-cooling-vest",
      "sku": null,
      "name_zh": "水激活降温背心",
      "name_en": "HYDROACTIVE COOLING VEST",